schema_name,table_name,index_name,index_oid,indexdef,is_constraint_owned,constraint_name,constraint_type
landscape,knowledge_facts,knowledge_facts_created_by_id_a1fa9f24,1286578,CREATE INDEX knowledge_facts_created_by_id_a1fa9f24 ON landscape.knowledge_facts USING btree (created_by_id),False,,
landscape,knowledge_facts,knowledge_facts_is_current_3cf05c45,1286576,CREATE INDEX knowledge_facts_is_current_3cf05c45 ON landscape.knowledge_facts USING btree (is_current),False,,
landscape,knowledge_facts,knowledge_facts_object_entity_id_ca9e8ef5,1286579,CREATE INDEX knowledge_facts_object_entity_id_ca9e8ef5 ON landscape.knowledge_facts USING btree (object_entity_id),False,,
landscape,knowledge_facts,knowledge_facts_pkey,1286496,CREATE UNIQUE INDEX knowledge_facts_pkey ON landscape.knowledge_facts USING btree (fact_id),True,knowledge_facts_superseded_by_id_eee8e8cb_fk_knowledge,f
landscape,knowledge_facts,knowledge_facts_predicate_b00107dd,1286572,CREATE INDEX knowledge_facts_predicate_b00107dd ON landscape.knowledge_facts USING btree (predicate),False,,
landscape,knowledge_facts,knowledge_facts_predicate_b00107dd_like,1286573,CREATE INDEX knowledge_facts_predicate_b00107dd_like ON landscape.knowledge_facts USING btree (predicate varchar_pattern_ops),False,,
landscape,knowledge_facts,knowledge_facts_source_type_7df43544,1286574,CREATE INDEX knowledge_facts_source_type_7df43544 ON landscape.knowledge_facts USING btree (source_type),False,,
landscape,knowledge_facts,knowledge_facts_source_type_7df43544_like,1286575,CREATE INDEX knowledge_facts_source_type_7df43544_like ON landscape.knowledge_facts USING btree (source_type varchar_pattern_ops),False,,
landscape,knowledge_facts,knowledge_facts_subject_entity_id_0c130194,1286580,CREATE INDEX knowledge_facts_subject_entity_id_0c130194 ON landscape.knowledge_facts USING btree (subject_entity_id),False,,
landscape,knowledge_facts,knowledge_facts_superseded_by_id_eee8e8cb,1286581,CREATE INDEX knowledge_facts_superseded_by_id_eee8e8cb ON landscape.knowledge_facts USING btree (superseded_by_id),False,,
landscape,knowledge_insights,knowledge_i_acknowl_7d6024_idx,1286529,"CREATE INDEX knowledge_i_acknowl_7d6024_idx ON landscape.knowledge_insights USING btree (acknowledged, severity)",False,,
landscape,knowledge_insights,knowledge_i_insight_965cc4_idx,1286530,"CREATE INDEX knowledge_i_insight_965cc4_idx ON landscape.knowledge_insights USING btree (insight_type, created_at)",False,,
landscape,knowledge_insights,knowledge_i_subject_c1bcf7_idx,1286528,"CREATE INDEX knowledge_i_subject_c1bcf7_idx ON landscape.knowledge_insights USING btree (subject_entity_id, insight_type)",False,,
landscape,knowledge_insights,knowledge_insights_acknowledged_7eb9491e,1286594,CREATE INDEX knowledge_insights_acknowledged_7eb9491e ON landscape.knowledge_insights USING btree (acknowledged),False,,
landscape,knowledge_insights,knowledge_insights_acknowledged_by_id_68ba1117,1286596,CREATE INDEX knowledge_insights_acknowledged_by_id_68ba1117 ON landscape.knowledge_insights USING btree (acknowledged_by_id),False,,
landscape,knowledge_insights,knowledge_insights_created_at_9aeca26f,1286595,CREATE INDEX knowledge_insights_created_at_9aeca26f ON landscape.knowledge_insights USING btree (created_at),False,,
landscape,knowledge_insights,knowledge_insights_insight_type_4d527f2b,1286592,CREATE INDEX knowledge_insights_insight_type_4d527f2b ON landscape.knowledge_insights USING btree (insight_type),False,,
landscape,knowledge_insights,knowledge_insights_insight_type_4d527f2b_like,1286593,CREATE INDEX knowledge_insights_insight_type_4d527f2b_like ON landscape.knowledge_insights USING btree (insight_type varchar_pattern_ops),False,,
landscape,knowledge_insights,knowledge_insights_pkey,1286504,CREATE UNIQUE INDEX knowledge_insights_pkey ON landscape.knowledge_insights USING btree (insight_id),True,knowledge_insights_pkey,p
landscape,knowledge_insights,knowledge_insights_subject_entity_id_c3b729c9,1286597,CREATE INDEX knowledge_insights_subject_entity_id_c3b729c9 ON landscape.knowledge_insights USING btree (subject_entity_id),False,,
landscape,knowledge_interactions,knowledge_i_query_i_cc952f_idx,1286535,CREATE INDEX knowledge_i_query_i_cc952f_idx ON landscape.knowledge_interactions USING btree (query_intent),False,,
landscape,knowledge_interactions,knowledge_i_session_7869de_idx,1286534,"CREATE INDEX knowledge_i_session_7869de_idx ON landscape.knowledge_interactions USING btree (session_id, created_at)",False,,
landscape,knowledge_interactions,knowledge_i_user_fe_5c8b7f_idx,1286536,CREATE INDEX knowledge_i_user_fe_5c8b7f_idx ON landscape.knowledge_interactions USING btree (user_feedback),False,,
landscape,knowledge_interactions,knowledge_interactions_created_at_7a47ab34,1286611,CREATE INDEX knowledge_interactions_created_at_7a47ab34 ON landscape.knowledge_interactions USING btree (created_at),False,,
landscape,knowledge_interactions,knowledge_interactions_pkey,1286519,CREATE UNIQUE INDEX knowledge_interactions_pkey ON landscape.knowledge_interactions USING btree (interaction_id),True,knowledge_interactions_pkey,p
landscape,knowledge_interactions,knowledge_interactions_session_id_7f4000a5,1286612,CREATE INDEX knowledge_interactions_session_id_7f4000a5 ON landscape.knowledge_interactions USING btree (session_id),False,,
landscape,knowledge_sessions,idx_active_sessions,1286533,CREATE INDEX idx_active_sessions ON landscape.knowledge_sessions USING btree (session_end) WHERE (session_end IS NULL),False,,
landscape,knowledge_sessions,knowledge_s_session_5b8f09_idx,1286532,CREATE INDEX knowledge_s_session_5b8f09_idx ON landscape.knowledge_sessions USING btree (session_start),False,,
landscape,knowledge_sessions,knowledge_s_user_id_c64165_idx,1286531,"CREATE INDEX knowledge_s_user_id_c64165_idx ON landscape.knowledge_sessions USING btree (user_id, project_id)",False,,
landscape,knowledge_sessions,knowledge_sessions_pkey,1286511,CREATE UNIQUE INDEX knowledge_sessions_pkey ON landscape.knowledge_sessions USING btree (session_id),True,knowledge_interactio_session_id_7f4000a5_fk_knowledge,f
landscape,knowledge_sessions,knowledge_sessions_project_id_5f44cc1b,1286603,CREATE INDEX knowledge_sessions_project_id_5f44cc1b ON landscape.knowledge_sessions USING btree (project_id),False,,
landscape,knowledge_sessions,knowledge_sessions_session_start_740f4f0a,1286604,CREATE INDEX knowledge_sessions_session_start_740f4f0a ON landscape.knowledge_sessions USING btree (session_start),False,,
landscape,knowledge_sessions,knowledge_sessions_user_id_fa891383,1286605,CREATE INDEX knowledge_sessions_user_id_fa891383 ON landscape.knowledge_sessions USING btree (user_id),False,,
landscape,land_use_pricing,idx_land_use_pricing_benchmark,843897,CREATE INDEX idx_land_use_pricing_benchmark ON landscape.land_use_pricing USING btree (benchmark_id),False,,
landscape,land_use_pricing,idx_land_use_pricing_geography,843898,CREATE INDEX idx_land_use_pricing_geography ON landscape.land_use_pricing USING btree (market_geography),False,,
landscape,land_use_pricing,idx_land_use_pricing_project,352268,CREATE INDEX idx_land_use_pricing_project ON landscape.land_use_pricing USING btree (project_id),False,,
landscape,land_use_pricing,idx_land_use_pricing_project_product,958489,"CREATE INDEX idx_land_use_pricing_project_product ON landscape.land_use_pricing USING btree (project_id, lu_type_code, product_code)",False,,
landscape,land_use_pricing,land_use_pricing_pkey,352264,CREATE UNIQUE INDEX land_use_pricing_pkey ON landscape.land_use_pricing USING btree (id),True,land_use_pricing_pkey,p
landscape,land_use_pricing,land_use_pricing_project_lu_product_key,958487,"CREATE UNIQUE INDEX land_use_pricing_project_lu_product_key ON landscape.land_use_pricing USING btree (project_id, lu_type_code, product_code)",True,land_use_pricing_project_lu_product_key,u
landscape,land_use_pricing,land_use_pricing_project_type_product_key,876544,"CREATE UNIQUE INDEX land_use_pricing_project_type_product_key ON landscape.land_use_pricing USING btree (project_id, lu_type_code, product_code)",True,land_use_pricing_project_type_product_key,u
landscape,landscaper_absorption_detail,idx_landscaper_absorption_benchmark,892985,CREATE INDEX idx_landscaper_absorption_benchmark ON landscape.landscaper_absorption_detail USING btree (benchmark_id),False,,
landscape,landscaper_absorption_detail,idx_landscaper_absorption_geography,892987,CREATE INDEX idx_landscaper_absorption_geography ON landscape.landscaper_absorption_detail USING btree (market_geography),False,,
landscape,landscaper_absorption_detail,idx_landscaper_absorption_lot_size,892988,CREATE INDEX idx_landscaper_absorption_lot_size ON landscape.landscaper_absorption_detail USING btree (lot_size_sf),False,,
landscape,landscaper_absorption_detail,idx_landscaper_absorption_period,892989,CREATE INDEX idx_landscaper_absorption_period ON landscape.landscaper_absorption_detail USING btree (as_of_period),False,,
landscape,landscaper_absorption_detail,idx_landscaper_absorption_source,892986,CREATE INDEX idx_landscaper_absorption_source ON landscape.landscaper_absorption_detail USING btree (data_source_type),False,,
landscape,landscaper_absorption_detail,landscaper_absorption_detail_pkey,892978,CREATE UNIQUE INDEX landscaper_absorption_detail_pkey ON landscape.landscaper_absorption_detail USING btree (detail_id),True,landscaper_absorption_detail_pkey,p
landscape,landscaper_activity,idx_landscaper_activity_created,1622017,"CREATE INDEX idx_landscaper_activity_created ON landscape.landscaper_activity USING btree (project_id, created_at DESC)",False,,
landscape,landscaper_activity,idx_landscaper_activity_project,1622016,CREATE INDEX idx_landscaper_activity_project ON landscape.landscaper_activity USING btree (project_id),False,,
landscape,landscaper_activity,idx_landscaper_activity_project_created,1450005,"CREATE INDEX idx_landscaper_activity_project_created ON landscape.landscaper_activity USING btree (project_id, created_at DESC)",False,,
landscape,landscaper_activity,idx_landscaper_activity_project_read,1450006,"CREATE INDEX idx_landscaper_activity_project_read ON landscape.landscaper_activity USING btree (project_id, is_read)",False,,
landscape,landscaper_activity,idx_landscaper_activity_read,1622018,"CREATE INDEX idx_landscaper_activity_read ON landscape.landscaper_activity USING btree (project_id, is_read)",False,,
landscape,landscaper_activity,idx_landscaper_activity_source,1450007,"CREATE INDEX idx_landscaper_activity_source ON landscape.landscaper_activity USING btree (source_type, source_id)",False,,
landscape,landscaper_activity,landscaper_activity_pkey,1449998,CREATE UNIQUE INDEX landscaper_activity_pkey ON landscape.landscaper_activity USING btree (activity_id),True,landscaper_activity_pkey,p
landscape,landscaper_advice,landscaper__created_57ae5a_idx,1081387,CREATE INDEX landscaper__created_57ae5a_idx ON landscape.landscaper_advice USING btree (created_at),False,,
landscape,landscaper_advice,landscaper__project_948878_idx,1081385,"CREATE INDEX landscaper__project_948878_idx ON landscape.landscaper_advice USING btree (project_id, assumption_key)",False,,
landscape,landscaper_advice,landscaper__project_e8f509_idx,1081386,"CREATE INDEX landscaper__project_e8f509_idx ON landscape.landscaper_advice USING btree (project_id, lifecycle_stage)",False,,
landscape,landscaper_advice,landscaper_advice_message_id_5653931d,1081411,CREATE INDEX landscaper_advice_message_id_5653931d ON landscape.landscaper_advice USING btree (message_id),False,,
landscape,landscaper_advice,landscaper_advice_message_id_5653931d_like,1081412,CREATE INDEX landscaper_advice_message_id_5653931d_like ON landscape.landscaper_advice USING btree (message_id varchar_pattern_ops),False,,
landscape,landscaper_advice,landscaper_advice_pkey,1081381,CREATE UNIQUE INDEX landscaper_advice_pkey ON landscape.landscaper_advice USING btree (advice_id),True,landscaper_advice_pkey,p
landscape,landscaper_advice,landscaper_advice_project_id_6fb9f5af,1081413,CREATE INDEX landscaper_advice_project_id_6fb9f5af ON landscape.landscaper_advice USING btree (project_id),False,,
landscape,landscaper_chat_message,idx_chat_message_project_tab,1613825,"CREATE INDEX idx_chat_message_project_tab ON landscape.landscaper_chat_message USING btree (project_id, active_tab)",False,,
landscape,landscaper_chat_message,landscaper__project_0fbb3d_idx,1081383,"CREATE INDEX landscaper__project_0fbb3d_idx ON landscape.landscaper_chat_message USING btree (project_id, ""timestamp"")",False,,
landscape,landscaper_chat_message,landscaper__timesta_8945c8_idx,1081384,"CREATE INDEX landscaper__timesta_8945c8_idx ON landscape.landscaper_chat_message USING btree (""timestamp"")",False,,
landscape,landscaper_chat_message,landscaper_chat_message_message_id_27da4cf7_like,1081398,CREATE INDEX landscaper_chat_message_message_id_27da4cf7_like ON landscape.landscaper_chat_message USING btree (message_id varchar_pattern_ops),False,,
landscape,landscaper_chat_message,landscaper_chat_message_pkey,1081373,CREATE UNIQUE INDEX landscaper_chat_message_pkey ON landscape.landscaper_chat_message USING btree (message_id),True,landscaper_chat_message_pkey,p
landscape,landscaper_chat_message,landscaper_chat_message_project_id_fc77d355,1081399,CREATE INDEX landscaper_chat_message_project_id_fc77d355 ON landscape.landscaper_chat_message USING btree (project_id),False,,
landscape,landscaper_chat_message,landscaper_chat_message_user_id_263e4adb,1081400,CREATE INDEX landscaper_chat_message_user_id_263e4adb ON landscape.landscaper_chat_message USING btree (user_id),False,,
landscape,lu_acreage_allocation_type,lu_acreage_allocation_type_allocation_type_code_key,1343603,CREATE UNIQUE INDEX lu_acreage_allocation_type_allocation_type_code_key ON landscape.lu_acreage_allocation_type USING btree (allocation_type_code),True,lu_acreage_allocation_type_allocation_type_code_key,u
landscape,lu_acreage_allocation_type,lu_acreage_allocation_type_pkey,1343601,CREATE UNIQUE INDEX lu_acreage_allocation_type_pkey ON landscape.lu_acreage_allocation_type USING btree (allocation_type_id),True,tbl_acreage_allocation_allocation_type_id_fkey,f
landscape,lu_com_spec,lu_com_spec_pkey,114779,CREATE UNIQUE INDEX lu_com_spec_pkey ON landscape.lu_com_spec USING btree (com_spec_id),True,lu_com_spec_pkey,p
landscape,lu_family,idx_lu_family_active,213000,CREATE INDEX idx_lu_family_active ON landscape.lu_family USING btree (active),False,,
landscape,lu_family,lu_family_code_key,114698,CREATE UNIQUE INDEX lu_family_code_key ON landscape.lu_family USING btree (code),True,lu_family_code_key,u
landscape,lu_family,lu_family_pkey,114696,CREATE UNIQUE INDEX lu_family_pkey ON landscape.lu_family USING btree (family_id),True,lu_family_pkey,p
landscape,lu_lease_status,lu_lease_status_pkey,500085,CREATE UNIQUE INDEX lu_lease_status_pkey ON landscape.lu_lease_status USING btree (status_code),True,lu_lease_status_pkey,p
landscape,lu_lease_type,lu_lease_type_pkey,500092,CREATE UNIQUE INDEX lu_lease_type_pkey ON landscape.lu_lease_type USING btree (type_code),True,lu_lease_type_pkey,p
landscape,lu_market,lu_market_market_code_key,1466397,CREATE UNIQUE INDEX lu_market_market_code_key ON landscape.lu_market USING btree (market_code),True,lu_market_market_code_key,u
landscape,lu_market,lu_market_pkey,1466395,CREATE UNIQUE INDEX lu_market_pkey ON landscape.lu_market USING btree (market_id),True,lu_market_pkey,p
landscape,lu_picklist_display_config,lu_picklist_display_config_list_code_context_key,1490953,"CREATE UNIQUE INDEX lu_picklist_display_config_list_code_context_key ON landscape.lu_picklist_display_config USING btree (list_code, context)",True,lu_picklist_display_config_list_code_context_key,u
landscape,lu_picklist_display_config,lu_picklist_display_config_pkey,1490951,CREATE UNIQUE INDEX lu_picklist_display_config_pkey ON landscape.lu_picklist_display_config USING btree (config_id),True,lu_picklist_display_config_pkey,p
landscape,lu_property_subtype,lu_property_subtype_pkey,1490963,CREATE UNIQUE INDEX lu_property_subtype_pkey ON landscape.lu_property_subtype USING btree (subtype_id),True,lu_property_subtype_pkey,p
landscape,lu_property_subtype,lu_property_subtype_property_type_code_subtype_code_key,1490965,"CREATE UNIQUE INDEX lu_property_subtype_property_type_code_subtype_code_key ON landscape.lu_property_subtype USING btree (property_type_code, subtype_code)",True,lu_property_subtype_property_type_code_subtype_code_key,u
landscape,lu_recovery_structure,lu_recovery_structure_pkey,500099,CREATE UNIQUE INDEX lu_recovery_structure_pkey ON landscape.lu_recovery_structure USING btree (structure_code),True,lu_recovery_structure_pkey,p
landscape,lu_res_spec,lu_res_spec_pkey,114759,CREATE UNIQUE INDEX lu_res_spec_pkey ON landscape.lu_res_spec USING btree (res_spec_id),True,lu_res_spec_pkey,p
landscape,lu_subtype,lu_subtype_family_id_code_key,344077,"CREATE UNIQUE INDEX lu_subtype_family_id_code_key ON landscape.lu_subtype USING btree (family_id, code)",True,lu_subtype_family_id_code_key,u
landscape,lu_subtype,lu_subtype_pkey1,344075,CREATE UNIQUE INDEX lu_subtype_pkey1 ON landscape.lu_subtype USING btree (subtype_id),True,lu_subtype_pkey1,p
landscape,lu_type,idx_lu_subtype_active,213001,CREATE INDEX idx_lu_subtype_active ON landscape.lu_type USING btree (active),False,,
landscape,lu_type,idx_lu_subtype_family,212992,CREATE INDEX idx_lu_subtype_family ON landscape.lu_type USING btree (family_id),False,,
landscape,lu_type,lu_subtype_code_key,114709,CREATE UNIQUE INDEX lu_subtype_code_key ON landscape.lu_type USING btree (code),True,lu_subtype_code_key,u
landscape,lu_type,lu_subtype_pkey,114707,CREATE UNIQUE INDEX lu_subtype_pkey ON landscape.lu_type USING btree (type_id),True,lu_subtype_pkey,p
landscape,management_overhead,idx_management_overhead_project,1245221,CREATE INDEX idx_management_overhead_project ON landscape.management_overhead USING btree (project_id),False,,
landscape,management_overhead,management_overhead_pkey,1245214,CREATE UNIQUE INDEX management_overhead_pkey ON landscape.management_overhead USING btree (id),True,management_overhead_pkey,p
landscape,market_activity,idx_market_activity_geo_type,1220623,"CREATE INDEX idx_market_activity_geo_type ON landscape.market_activity USING btree (msa_code, geography_type)",False,,
landscape,market_activity,idx_market_activity_lookup,1220620,"CREATE INDEX idx_market_activity_lookup ON landscape.market_activity USING btree (msa_code, geography_name, period_end_date DESC)",False,,
landscape,market_activity,idx_market_activity_period,1220622,CREATE INDEX idx_market_activity_period ON landscape.market_activity USING btree (period_end_date DESC),False,,
landscape,market_activity,idx_market_activity_source,1220621,"CREATE INDEX idx_market_activity_source ON landscape.market_activity USING btree (source, metric_type)",False,,
landscape,market_activity,market_activity_msa_code_source_metric_type_geography_type__key,1220618,"CREATE UNIQUE INDEX market_activity_msa_code_source_metric_type_geography_type__key ON landscape.market_activity USING btree (msa_code, source, metric_type, geography_type, geography_name, period_end_date)",True,market_activity_msa_code_source_metric_type_geography_type__key,u
landscape,market_activity,market_activity_pkey,1220616,CREATE UNIQUE INDEX market_activity_pkey ON landscape.market_activity USING btree (id),True,market_activity_pkey,p
landscape,market_assumptions,idx_market_assumptions_dvl_timeseries,368640,"CREATE INDEX idx_market_assumptions_dvl_timeseries ON landscape.market_assumptions USING btree (project_id, dvl_per_year, dvl_per_quarter, dvl_per_month)",False,,
landscape,market_assumptions,idx_market_assumptions_project_lutype,352256,"CREATE INDEX idx_market_assumptions_project_lutype ON landscape.market_assumptions USING btree (project_id, lu_type_code)",False,,
landscape,market_assumptions,market_assumptions_pkey,204806,CREATE UNIQUE INDEX market_assumptions_pkey ON landscape.market_assumptions USING btree (project_id),True,market_assumptions_pkey,p
landscape,market_competitive_project_exclusions,idx_comp_exclusions_project,1278034,CREATE INDEX idx_comp_exclusions_project ON landscape.market_competitive_project_exclusions USING btree (project_id),False,,
landscape,market_competitive_project_exclusions,market_competitive_project_exc_project_id_source_project_id_key,1278027,"CREATE UNIQUE INDEX market_competitive_project_exc_project_id_source_project_id_key ON landscape.market_competitive_project_exclusions USING btree (project_id, source_project_id)",True,market_competitive_project_exc_project_id_source_project_id_key,u
landscape,market_competitive_project_exclusions,market_competitive_project_exclusions_pkey,1278025,CREATE UNIQUE INDEX market_competitive_project_exclusions_pkey ON landscape.market_competitive_project_exclusions USING btree (id),True,market_competitive_project_exclusions_pkey,p
landscape,market_competitive_project_products,idx_comp_products_competitive_project,1278017,CREATE INDEX idx_comp_products_competitive_project ON landscape.market_competitive_project_products USING btree (competitive_project_id),False,,
landscape,market_competitive_project_products,idx_comp_products_lot_width,1278016,CREATE INDEX idx_comp_products_lot_width ON landscape.market_competitive_project_products USING btree (lot_width_ft),False,,
landscape,market_competitive_project_products,idx_comp_products_project_product,1278014,"CREATE UNIQUE INDEX idx_comp_products_project_product ON landscape.market_competitive_project_products USING btree (competitive_project_id, product_id) WHERE (product_id IS NOT NULL)",False,,
landscape,market_competitive_project_products,idx_comp_products_project_width,1278015,"CREATE UNIQUE INDEX idx_comp_products_project_width ON landscape.market_competitive_project_products USING btree (competitive_project_id, lot_width_ft) WHERE ((product_id IS NULL) AND (lot_width_ft IS NOT NULL))",False,,
landscape,market_competitive_project_products,market_competitive_project_products_pkey,1278002,CREATE UNIQUE INDEX market_competitive_project_products_pkey ON landscape.market_competitive_project_products USING btree (id),True,market_competitive_project_products_pkey,p
landscape,market_competitive_projects,idx_market_comps_project,1277990,CREATE INDEX idx_market_comps_project ON landscape.market_competitive_projects USING btree (project_id),False,,
landscape,market_competitive_projects,idx_market_comps_project_source_unique,1277992,"CREATE UNIQUE INDEX idx_market_comps_project_source_unique ON landscape.market_competitive_projects USING btree (project_id, source_project_id) WHERE (source_project_id IS NOT NULL)",False,,
landscape,market_competitive_projects,idx_market_comps_source_project,1277991,CREATE INDEX idx_market_comps_source_project ON landscape.market_competitive_projects USING btree (source_project_id),False,,
landscape,market_competitive_projects,market_competitive_projects_pkey,1277983,CREATE UNIQUE INDEX market_competitive_projects_pkey ON landscape.market_competitive_projects USING btree (id),True,market_competitive_projects_pkey,p
landscape,mkt_data_source_registry,mkt_data_source_registry_pkey,1236998,CREATE UNIQUE INDEX mkt_data_source_registry_pkey ON landscape.mkt_data_source_registry USING btree (source_id),True,mkt_data_source_registry_pkey,p
landscape,mkt_data_source_registry,mkt_data_source_registry_source_code_609b59ab_like,1237023,CREATE INDEX mkt_data_source_registry_source_code_609b59ab_like ON landscape.mkt_data_source_registry USING btree (source_code varchar_pattern_ops),False,,
landscape,mkt_data_source_registry,mkt_data_source_registry_source_code_key,1237000,CREATE UNIQUE INDEX mkt_data_source_registry_source_code_key ON landscape.mkt_data_source_registry USING btree (source_code),True,mkt_data_source_registry_source_code_key,u
landscape,mkt_new_home_project,idx_mkt_nhp_builder,1237038,CREATE INDEX idx_mkt_nhp_builder ON landscape.mkt_new_home_project USING btree (builder_name),False,,
landscape,mkt_new_home_project,idx_mkt_nhp_cbsa,1237044,CREATE INDEX idx_mkt_nhp_cbsa ON landscape.mkt_new_home_project USING btree (cbsa_code),False,,
landscape,mkt_new_home_project,idx_mkt_nhp_city,1237040,CREATE INDEX idx_mkt_nhp_city ON landscape.mkt_new_home_project USING btree (city),False,,
landscape,mkt_new_home_project,idx_mkt_nhp_effective_date,1237041,CREATE INDEX idx_mkt_nhp_effective_date ON landscape.mkt_new_home_project USING btree (effective_date),False,,
landscape,mkt_new_home_project,idx_mkt_nhp_location,1237045,"CREATE INDEX idx_mkt_nhp_location ON landscape.mkt_new_home_project USING btree (latitude, longitude)",False,,
landscape,mkt_new_home_project,idx_mkt_nhp_lot_width,1237039,CREATE INDEX idx_mkt_nhp_lot_width ON landscape.mkt_new_home_project USING btree (lot_width_ft),False,,
landscape,mkt_new_home_project,idx_mkt_nhp_lu_product,1237046,CREATE INDEX idx_mkt_nhp_lu_product ON landscape.mkt_new_home_project USING btree (lu_product_id),False,,
landscape,mkt_new_home_project,idx_mkt_nhp_lu_type,1237047,CREATE INDEX idx_mkt_nhp_lu_type ON landscape.mkt_new_home_project USING btree (lu_type_id),False,,
landscape,mkt_new_home_project,idx_mkt_nhp_master_plan,1237037,CREATE INDEX idx_mkt_nhp_master_plan ON landscape.mkt_new_home_project USING btree (master_plan_name),False,,
landscape,mkt_new_home_project,idx_mkt_nhp_project_name,1237036,CREATE INDEX idx_mkt_nhp_project_name ON landscape.mkt_new_home_project USING btree (project_name),False,,
landscape,mkt_new_home_project,idx_mkt_nhp_source,1237042,CREATE INDEX idx_mkt_nhp_source ON landscape.mkt_new_home_project USING btree (source_id),False,,
landscape,mkt_new_home_project,idx_mkt_nhp_status,1237043,CREATE INDEX idx_mkt_nhp_status ON landscape.mkt_new_home_project USING btree (status),False,,
