schema_name,table_name,index_name,index_oid,indexdef,is_constraint_owned,constraint_name,constraint_type
landscape,mkt_new_home_project,mkt_new_home_project_pkey,1237014,CREATE UNIQUE INDEX mkt_new_home_project_pkey ON landscape.mkt_new_home_project USING btree (record_id),True,mkt_new_home_project_pkey,p
landscape,mkt_new_home_project,mkt_new_home_project_source_id_cbf21c81,1237035,CREATE INDEX mkt_new_home_project_source_id_cbf21c81 ON landscape.mkt_new_home_project USING btree (source_id),False,,
landscape,mkt_new_home_project,uq_mkt_project_source_date,1237016,"CREATE UNIQUE INDEX uq_mkt_project_source_date ON landscape.mkt_new_home_project USING btree (source_id, source_project_id, effective_date)",True,uq_mkt_project_source_date,u
landscape,mkt_permit_history,idx_mkt_permit_jurisdiction,1237019,CREATE INDEX idx_mkt_permit_jurisdiction ON landscape.mkt_permit_history USING btree (jurisdiction_name),False,,
landscape,mkt_permit_history,idx_mkt_permit_month,1237018,CREATE INDEX idx_mkt_permit_month ON landscape.mkt_permit_history USING btree (permit_month),False,,
landscape,mkt_permit_history,idx_mkt_permit_source,1237020,CREATE INDEX idx_mkt_permit_source ON landscape.mkt_permit_history USING btree (source_id),False,,
landscape,mkt_permit_history,mkt_permit_history_pkey,1237006,CREATE UNIQUE INDEX mkt_permit_history_pkey ON landscape.mkt_permit_history USING btree (record_id),True,mkt_permit_history_pkey,p
landscape,mkt_permit_history,mkt_permit_history_source_id_4d1eb402,1237029,CREATE INDEX mkt_permit_history_source_id_4d1eb402 ON landscape.mkt_permit_history USING btree (source_id),False,,
landscape,mkt_permit_history,uq_mkt_permit_month_jurisdiction,1237021,"CREATE UNIQUE INDEX uq_mkt_permit_month_jurisdiction ON landscape.mkt_permit_history USING btree (source_id, permit_month, jurisdiction_name)",True,uq_mkt_permit_month_jurisdiction,u
landscape,opex_account_migration_map,opex_account_migration_map_pkey,1515555,CREATE UNIQUE INDEX opex_account_migration_map_pkey ON landscape.opex_account_migration_map USING btree (old_account_id),True,opex_account_migration_map_pkey,p
landscape,planning_doc,planning_doc_pkey,114749,CREATE UNIQUE INDEX planning_doc_pkey ON landscape.planning_doc USING btree (doc_id),True,planning_doc_pkey,p
landscape,project_boundaries,idx_project_boundaries_geometry,393256,CREATE INDEX idx_project_boundaries_geometry ON landscape.project_boundaries USING gist (dissolved_geometry),False,,
landscape,project_boundaries,idx_project_boundaries_project_id,393252,CREATE INDEX idx_project_boundaries_project_id ON landscape.project_boundaries USING btree (project_id),False,,
landscape,project_boundaries,project_boundaries_pkey,393225,CREATE UNIQUE INDEX project_boundaries_pkey ON landscape.project_boundaries USING btree (boundary_id),True,project_boundaries_pkey,p
landscape,project_jurisdiction_mapping,project_jurisdiction_mapping_pkey,327708,CREATE UNIQUE INDEX project_jurisdiction_mapping_pkey ON landscape.project_jurisdiction_mapping USING btree (mapping_id),True,project_jurisdiction_mapping_pkey,p
landscape,project_parcel_boundaries,idx_project_parcel_boundaries_boundary_id,393253,CREATE INDEX idx_project_parcel_boundaries_boundary_id ON landscape.project_parcel_boundaries USING btree (boundary_id),False,,
landscape,project_parcel_boundaries,idx_project_parcel_boundaries_geometry,393257,CREATE INDEX idx_project_parcel_boundaries_geometry ON landscape.project_parcel_boundaries USING gist (geometry),False,,
landscape,project_parcel_boundaries,idx_project_parcel_boundaries_parcel_id,393255,CREATE INDEX idx_project_parcel_boundaries_parcel_id ON landscape.project_parcel_boundaries USING btree (parcel_id),False,,
landscape,project_parcel_boundaries,idx_project_parcel_boundaries_project_id,393254,CREATE INDEX idx_project_parcel_boundaries_project_id ON landscape.project_parcel_boundaries USING btree (project_id),False,,
landscape,project_parcel_boundaries,project_parcel_boundaries_pkey,393240,CREATE UNIQUE INDEX project_parcel_boundaries_pkey ON landscape.project_parcel_boundaries USING btree (parcel_boundary_id),True,project_parcel_boundaries_pkey,p
landscape,report_templates,idx_report_active,1097736,CREATE INDEX idx_report_active ON landscape.report_templates USING btree (is_active),False,,
landscape,report_templates,report_templates_pkey,1097734,CREATE UNIQUE INDEX report_templates_pkey ON landscape.report_templates USING btree (id),True,report_templates_pkey,p
landscape,res_lot_product,idx_res_lot_product_active,852126,CREATE INDEX idx_res_lot_product_active ON landscape.res_lot_product USING btree (is_active),False,,
landscape,res_lot_product,idx_res_lot_product_type,852125,CREATE INDEX idx_res_lot_product_type ON landscape.res_lot_product USING btree (type_id),False,,
landscape,res_lot_product,res_lot_product_code_key,114725,CREATE UNIQUE INDEX res_lot_product_code_key ON landscape.res_lot_product USING btree (code),True,res_lot_product_code_key,u
landscape,res_lot_product,res_lot_product_pkey,114723,CREATE UNIQUE INDEX res_lot_product_pkey ON landscape.res_lot_product USING btree (product_id),True,res_lot_product_pkey,p
landscape,sale_names,idx_sale_names_project,1122320,CREATE INDEX idx_sale_names_project ON landscape.sale_names USING btree (project_id),False,,
landscape,sale_names,sale_names_pkey,1122311,CREATE UNIQUE INDEX sale_names_pkey ON landscape.sale_names USING btree (id),True,sale_names_pkey,p
landscape,sale_names,sale_names_project_id_sale_date_key,1122313,"CREATE UNIQUE INDEX sale_names_project_id_sale_date_key ON landscape.sale_names USING btree (project_id, sale_date)",True,sale_names_project_id_sale_date_key,u
landscape,spatial_ref_sys,spatial_ref_sys_pkey,270664,CREATE UNIQUE INDEX spatial_ref_sys_pkey ON landscape.spatial_ref_sys USING btree (srid),True,spatial_ref_sys_pkey,p
landscape,tbl_absorption_schedule,idx_absorption_parcel,507961,CREATE INDEX idx_absorption_parcel ON landscape.tbl_absorption_schedule USING btree (parcel_id),False,,
landscape,tbl_absorption_schedule,idx_absorption_phase,507960,CREATE INDEX idx_absorption_phase ON landscape.tbl_absorption_schedule USING btree (phase_id),False,,
landscape,tbl_absorption_schedule,idx_absorption_product,507962,CREATE INDEX idx_absorption_product ON landscape.tbl_absorption_schedule USING btree (product_code),False,,
landscape,tbl_absorption_schedule,idx_absorption_project_period,507959,"CREATE INDEX idx_absorption_project_period ON landscape.tbl_absorption_schedule USING btree (project_id, start_period)",False,,
landscape,tbl_absorption_schedule,idx_absorption_scenario,696395,CREATE INDEX idx_absorption_scenario ON landscape.tbl_absorption_schedule USING btree (scenario_id),False,,
landscape,tbl_absorption_schedule,tbl_absorption_schedule_pkey,507937,CREATE UNIQUE INDEX tbl_absorption_schedule_pkey ON landscape.tbl_absorption_schedule USING btree (absorption_id),True,tbl_absorption_schedule_pkey,p
landscape,tbl_acquisition,idx_acquisition_contact_id,163899,CREATE INDEX idx_acquisition_contact_id ON landscape.tbl_acquisition USING btree (contact_id),False,,
landscape,tbl_acquisition,idx_acquisition_project_id,163898,CREATE INDEX idx_acquisition_project_id ON landscape.tbl_acquisition USING btree (project_id),False,,
landscape,tbl_acquisition,tbl_acquisition_pkey,163876,CREATE UNIQUE INDEX tbl_acquisition_pkey ON landscape.tbl_acquisition USING btree (acquisition_id),True,tbl_acquisition_pkey,p
landscape,tbl_acreage_allocation,idx_acreage_project,1343642,CREATE INDEX idx_acreage_project ON landscape.tbl_acreage_allocation USING btree (project_id),False,,
landscape,tbl_acreage_allocation,idx_acreage_project_phase,1343643,"CREATE INDEX idx_acreage_project_phase ON landscape.tbl_acreage_allocation USING btree (project_id, phase_id)",False,,
landscape,tbl_acreage_allocation,idx_acreage_project_type,1343645,"CREATE INDEX idx_acreage_project_type ON landscape.tbl_acreage_allocation USING btree (project_id, allocation_type_code)",False,,
landscape,tbl_acreage_allocation,idx_acreage_type,1343644,CREATE INDEX idx_acreage_type ON landscape.tbl_acreage_allocation USING btree (allocation_type_code),False,,
landscape,tbl_acreage_allocation,tbl_acreage_allocation_pkey,1343615,CREATE UNIQUE INDEX tbl_acreage_allocation_pkey ON landscape.tbl_acreage_allocation USING btree (allocation_id),True,tbl_acreage_allocation_pkey,p
landscape,tbl_additional_income,idx_additional_income_lease,499871,CREATE INDEX idx_additional_income_lease ON landscape.tbl_additional_income USING btree (lease_id),False,,
landscape,tbl_additional_income,tbl_additional_income_pkey,499862,CREATE UNIQUE INDEX tbl_additional_income_pkey ON landscape.tbl_additional_income USING btree (additional_income_id),True,tbl_additional_income_pkey,p
landscape,tbl_additional_income,uq_additional_income_lease,499864,CREATE UNIQUE INDEX uq_additional_income_lease ON landscape.tbl_additional_income USING btree (lease_id),True,uq_additional_income_lease,u
landscape,tbl_ai_adjustment_suggestions,idx_ai_suggestions_comparable,778260,CREATE INDEX idx_ai_suggestions_comparable ON landscape.tbl_ai_adjustment_suggestions USING btree (comparable_id),False,,
landscape,tbl_ai_adjustment_suggestions,idx_ai_suggestions_type,778261,CREATE INDEX idx_ai_suggestions_type ON landscape.tbl_ai_adjustment_suggestions USING btree (adjustment_type),False,,
landscape,tbl_ai_adjustment_suggestions,tbl_ai_adjustment_suggestions_comparable_id_adjustment_type_key,778252,"CREATE UNIQUE INDEX tbl_ai_adjustment_suggestions_comparable_id_adjustment_type_key ON landscape.tbl_ai_adjustment_suggestions USING btree (comparable_id, adjustment_type)",True,tbl_ai_adjustment_suggestions_comparable_id_adjustment_type_key,u
landscape,tbl_ai_adjustment_suggestions,tbl_ai_adjustment_suggestions_pkey,778250,CREATE UNIQUE INDEX tbl_ai_adjustment_suggestions_pkey ON landscape.tbl_ai_adjustment_suggestions USING btree (ai_suggestion_id),True,tbl_ai_adjustment_suggestions_pkey,p
landscape,tbl_approval,tbl_approval_pkey,41020,CREATE UNIQUE INDEX tbl_approval_pkey ON landscape.tbl_approval USING btree (approval_id),True,tbl_approval_pkey,p
landscape,tbl_area,tbl_planarea_pkey,40972,CREATE UNIQUE INDEX tbl_planarea_pkey ON landscape.tbl_area USING btree (area_id),True,tbl_devphase_planarea_id_fkey,f
landscape,tbl_area,ux_planarea_project_area,147456,"CREATE UNIQUE INDEX ux_planarea_project_area ON landscape.tbl_area USING btree (project_id, area_no) WHERE (area_no IS NOT NULL)",False,,
landscape,tbl_assumptionrule,tbl_assumptionrule_pkey,41012,CREATE UNIQUE INDEX tbl_assumptionrule_pkey ON landscape.tbl_assumptionrule USING btree (rule_id),True,tbl_assumptionrule_pkey,p
landscape,tbl_base_rent,idx_base_rent_dates,499811,"CREATE INDEX idx_base_rent_dates ON landscape.tbl_base_rent USING btree (period_start_date, period_end_date)",False,,
landscape,tbl_base_rent,idx_base_rent_lease,499810,CREATE INDEX idx_base_rent_lease ON landscape.tbl_base_rent USING btree (lease_id),False,,
landscape,tbl_base_rent,tbl_base_rent_pkey,499801,CREATE UNIQUE INDEX tbl_base_rent_pkey ON landscape.tbl_base_rent USING btree (base_rent_id),True,tbl_base_rent_pkey,p
landscape,tbl_base_rent,uq_base_rent_lease_period,499803,"CREATE UNIQUE INDEX uq_base_rent_lease_period ON landscape.tbl_base_rent USING btree (lease_id, period_number)",True,uq_base_rent_lease_period,u
landscape,tbl_benchmark_ai_suggestions,idx_ai_suggestion_category,843882,CREATE INDEX idx_ai_suggestion_category ON landscape.tbl_benchmark_ai_suggestions USING btree (category),False,,
landscape,tbl_benchmark_ai_suggestions,idx_ai_suggestion_document,843881,CREATE INDEX idx_ai_suggestion_document ON landscape.tbl_benchmark_ai_suggestions USING btree (document_id),False,,
landscape,tbl_benchmark_ai_suggestions,idx_ai_suggestion_extraction_date,843883,CREATE INDEX idx_ai_suggestion_extraction_date ON landscape.tbl_benchmark_ai_suggestions USING btree (extraction_date),False,,
landscape,tbl_benchmark_ai_suggestions,idx_ai_suggestion_status,843880,CREATE INDEX idx_ai_suggestion_status ON landscape.tbl_benchmark_ai_suggestions USING btree (status),False,,
landscape,tbl_benchmark_ai_suggestions,idx_ai_suggestion_user,843879,CREATE INDEX idx_ai_suggestion_user ON landscape.tbl_benchmark_ai_suggestions USING btree (user_id),False,,
landscape,tbl_benchmark_ai_suggestions,tbl_benchmark_ai_suggestions_pkey,843857,CREATE UNIQUE INDEX tbl_benchmark_ai_suggestions_pkey ON landscape.tbl_benchmark_ai_suggestions USING btree (suggestion_id),True,tbl_benchmark_ai_suggestions_pkey,p
landscape,tbl_benchmark_contingency,idx_benchmark_contingency_benchmark_id,950285,CREATE INDEX idx_benchmark_contingency_benchmark_id ON landscape.tbl_benchmark_contingency USING btree (benchmark_id),False,,
landscape,tbl_benchmark_contingency,tbl_benchmark_contingency_pkey,950278,CREATE UNIQUE INDEX tbl_benchmark_contingency_pkey ON landscape.tbl_benchmark_contingency USING btree (benchmark_id),True,tbl_benchmark_contingency_pkey,p
landscape,tbl_benchmark_transaction_cost,idx_transaction_cost_benchmark,843843,CREATE INDEX idx_transaction_cost_benchmark ON landscape.tbl_benchmark_transaction_cost USING btree (benchmark_id),False,,
landscape,tbl_benchmark_transaction_cost,idx_transaction_cost_type,843844,CREATE INDEX idx_transaction_cost_type ON landscape.tbl_benchmark_transaction_cost USING btree (cost_type),False,,
landscape,tbl_benchmark_transaction_cost,tbl_benchmark_transaction_cost_pkey,843836,CREATE UNIQUE INDEX tbl_benchmark_transaction_cost_pkey ON landscape.tbl_benchmark_transaction_cost USING btree (transaction_cost_id),True,tbl_benchmark_transaction_cost_pkey,p
landscape,tbl_benchmark_unit_cost,idx_unit_cost_benchmark,843825,CREATE INDEX idx_unit_cost_benchmark ON landscape.tbl_benchmark_unit_cost USING btree (benchmark_id),False,,
landscape,tbl_benchmark_unit_cost,idx_unit_cost_phase,843826,CREATE INDEX idx_unit_cost_phase ON landscape.tbl_benchmark_unit_cost USING btree (cost_phase),False,,
landscape,tbl_benchmark_unit_cost,idx_unit_cost_work_type,843827,CREATE INDEX idx_unit_cost_work_type ON landscape.tbl_benchmark_unit_cost USING btree (work_type),False,,
landscape,tbl_benchmark_unit_cost,tbl_benchmark_unit_cost_pkey,843818,CREATE UNIQUE INDEX tbl_benchmark_unit_cost_pkey ON landscape.tbl_benchmark_unit_cost USING btree (unit_cost_id),True,tbl_benchmark_unit_cost_pkey,p
landscape,tbl_budget,tbl_budget_pkey,49158,CREATE UNIQUE INDEX tbl_budget_pkey ON landscape.tbl_budget USING btree (budget_id),True,tbl_budget_pkey,p
landscape,tbl_budget_fact,idx_budget_fact_category,1343549,CREATE INDEX idx_budget_fact_category ON landscape.tbl_budget_fact USING btree (category_id),False,,
landscape,tbl_budget_fact,idx_budget_fact_project,1343548,CREATE INDEX idx_budget_fact_project ON landscape.tbl_budget_fact USING btree (project_id),False,,
landscape,tbl_budget_fact,idx_budget_fact_project_category,1343550,"CREATE INDEX idx_budget_fact_project_category ON landscape.tbl_budget_fact USING btree (project_id, category_name)",False,,
landscape,tbl_budget_fact,tbl_budget_fact_pkey,1343526,CREATE UNIQUE INDEX tbl_budget_fact_pkey ON landscape.tbl_budget_fact USING btree (budget_fact_id),True,tbl_budget_fact_pkey,p
landscape,tbl_budget_fact,uq_budget_project_category,1343662,"CREATE UNIQUE INDEX uq_budget_project_category ON landscape.tbl_budget_fact USING btree (project_id, category_name)",True,uq_budget_project_category,u
landscape,tbl_budget_items,idx_budget_items_project,172073,CREATE INDEX idx_budget_items_project ON landscape.tbl_budget_items USING btree (project_id),False,,
landscape,tbl_budget_items,idx_budget_items_structure,172074,CREATE INDEX idx_budget_items_structure ON landscape.tbl_budget_items USING btree (structure_id),False,,
landscape,tbl_budget_items,idx_budget_items_timing,516349,"CREATE INDEX idx_budget_items_timing ON landscape.tbl_budget_items USING btree (project_id, start_period, timing_method)",False,,
landscape,tbl_budget_items,tbl_budget_items_pkey,172060,CREATE UNIQUE INDEX tbl_budget_items_pkey ON landscape.tbl_budget_items USING btree (budget_item_id),True,tbl_budget_items_pkey,p
landscape,tbl_budget_structure,idx_budget_structure_scope,172072,CREATE INDEX idx_budget_structure_scope ON landscape.tbl_budget_structure USING btree (scope),False,,
landscape,tbl_budget_structure,tbl_budget_structure_pkey,172042,CREATE UNIQUE INDEX tbl_budget_structure_pkey ON landscape.tbl_budget_structure USING btree (structure_id),True,tbl_budget_structure_pkey,p
landscape,tbl_budget_structure,tbl_budget_structure_scope_category_detail_key,172044,"CREATE UNIQUE INDEX tbl_budget_structure_scope_category_detail_key ON landscape.tbl_budget_structure USING btree (scope, category, detail)",True,tbl_budget_structure_scope_category_detail_key,u
landscape,tbl_budget_timing,idx_budget_timing_fact,311418,CREATE INDEX idx_budget_timing_fact ON landscape.tbl_budget_timing USING btree (fact_id),False,,
landscape,tbl_budget_timing,idx_budget_timing_period,311419,CREATE INDEX idx_budget_timing_period ON landscape.tbl_budget_timing USING btree (period_id),False,,
landscape,tbl_budget_timing,tbl_budget_timing_pkey,311404,CREATE UNIQUE INDEX tbl_budget_timing_pkey ON landscape.tbl_budget_timing USING btree (timing_id),True,tbl_budget_timing_pkey,p
landscape,tbl_budget_timing,uq_budget_timing,311406,"CREATE UNIQUE INDEX uq_budget_timing ON landscape.tbl_budget_timing USING btree (fact_id, period_id)",True,uq_budget_timing,u
landscape,tbl_calculation_period,idx_calculation_period_project,311395,"CREATE INDEX idx_calculation_period_project ON landscape.tbl_calculation_period USING btree (project_id, period_sequence)",False,,
landscape,tbl_calculation_period,tbl_calculation_period_pkey,311386,CREATE UNIQUE INDEX tbl_calculation_period_pkey ON landscape.tbl_calculation_period USING btree (period_id),True,tbl_calculation_period_pkey,p
landscape,tbl_calculation_period,uq_calculation_period_sequence,311388,"CREATE UNIQUE INDEX uq_calculation_period_sequence ON landscape.tbl_calculation_period USING btree (project_id, period_sequence)",True,uq_calculation_period_sequence,u
landscape,tbl_cap_rate_comps,idx_cap_rate_comps_income_approach,770139,CREATE INDEX idx_cap_rate_comps_income_approach ON landscape.tbl_cap_rate_comps USING btree (income_approach_id),False,,
landscape,tbl_cap_rate_comps,tbl_cap_rate_comps_pkey,770132,CREATE UNIQUE INDEX tbl_cap_rate_comps_pkey ON landscape.tbl_cap_rate_comps USING btree (cap_rate_comp_id),True,tbl_cap_rate_comps_pkey,p
landscape,tbl_capex_reserve,idx_capex_project,647373,CREATE INDEX idx_capex_project ON landscape.tbl_capex_reserve USING btree (project_id),False,,
landscape,tbl_capex_reserve,tbl_capex_reserve_pkey,647308,CREATE UNIQUE INDEX tbl_capex_reserve_pkey ON landscape.tbl_capex_reserve USING btree (capex_id),True,tbl_capex_reserve_pkey,p
landscape,tbl_capital_call,idx_capital_call_project,647376,CREATE INDEX idx_capital_call_project ON landscape.tbl_capital_call USING btree (project_id),False,,
landscape,tbl_capital_call,tbl_capital_call_pkey,647354,CREATE UNIQUE INDEX tbl_capital_call_pkey ON landscape.tbl_capital_call USING btree (capital_call_id),True,tbl_capital_call_pkey,p
landscape,tbl_capital_reserves,idx_capital_reserves_lease,516278,CREATE INDEX idx_capital_reserves_lease ON landscape.tbl_capital_reserves USING btree (trigger_lease_id),False,,
landscape,tbl_capital_reserves,idx_capital_reserves_project,516275,CREATE INDEX idx_capital_reserves_project ON landscape.tbl_capital_reserves USING btree (project_id),False,,
landscape,tbl_capital_reserves,idx_capital_reserves_trigger,516277,CREATE INDEX idx_capital_reserves_trigger ON landscape.tbl_capital_reserves USING btree (trigger_type),False,,
landscape,tbl_capital_reserves,idx_capital_reserves_type,516276,CREATE INDEX idx_capital_reserves_type ON landscape.tbl_capital_reserves USING btree (reserve_type),False,,
landscape,tbl_capital_reserves,tbl_capital_reserves_pkey,516263,CREATE UNIQUE INDEX tbl_capital_reserves_pkey ON landscape.tbl_capital_reserves USING btree (reserve_id),True,tbl_capital_reserves_pkey,p
landscape,tbl_capitalization,tbl_capitalization_pkey,49171,CREATE UNIQUE INDEX tbl_capitalization_pkey ON landscape.tbl_capitalization USING btree (capitalization_id),True,tbl_capitalization_pkey,p
landscape,tbl_cashflow,idx_cashflow_category,500026,CREATE INDEX idx_cashflow_category ON landscape.tbl_cashflow USING btree (cashflow_category),False,,
landscape,tbl_cashflow,idx_cashflow_lease,500029,"CREATE INDEX idx_cashflow_lease ON landscape.tbl_cashflow USING btree (lease_id, period_id)",False,,
landscape,tbl_cashflow,idx_cashflow_parcel,500027,"CREATE INDEX idx_cashflow_parcel ON landscape.tbl_cashflow USING btree (parcel_id, period_id)",False,,
landscape,tbl_cashflow,idx_cashflow_phase,500028,"CREATE INDEX idx_cashflow_phase ON landscape.tbl_cashflow USING btree (phase_id, period_id)",False,,
landscape,tbl_cashflow,idx_cashflow_project_period,500025,"CREATE INDEX idx_cashflow_project_period ON landscape.tbl_cashflow USING btree (project_id, period_id)",False,,
landscape,tbl_cashflow,tbl_cashflow_pkey,499998,CREATE UNIQUE INDEX tbl_cashflow_pkey ON landscape.tbl_cashflow USING btree (cashflow_id),True,tbl_cashflow_pkey,p
landscape,tbl_cashflow_summary,idx_summary_project_period,500061,"CREATE INDEX idx_summary_project_period ON landscape.tbl_cashflow_summary USING btree (project_id, period_id)",False,,
landscape,tbl_cashflow_summary,tbl_cashflow_summary_pkey,500052,CREATE UNIQUE INDEX tbl_cashflow_summary_pkey ON landscape.tbl_cashflow_summary USING btree (summary_id),True,tbl_cashflow_summary_pkey,p
landscape,tbl_cashflow_summary,uq_summary_project_period,500054,"CREATE UNIQUE INDEX uq_summary_project_period ON landscape.tbl_cashflow_summary USING btree (project_id, period_id)",True,uq_summary_project_period,u
landscape,tbl_closing_event,idx_closing_date,966704,CREATE INDEX idx_closing_date ON landscape.tbl_closing_event USING btree (closing_date),False,,
landscape,tbl_closing_event,idx_closing_sale_event,966703,CREATE INDEX idx_closing_sale_event ON landscape.tbl_closing_event USING btree (sale_event_id),False,,
landscape,tbl_closing_event,idx_closing_sequence,966705,"CREATE INDEX idx_closing_sequence ON landscape.tbl_closing_event USING btree (sale_event_id, closing_sequence)",False,,
landscape,tbl_closing_event,tbl_closing_event_pkey,966694,CREATE UNIQUE INDEX tbl_closing_event_pkey ON landscape.tbl_closing_event USING btree (closing_id),True,tbl_closing_event_pkey,p
landscape,tbl_closing_event,tbl_closing_event_sale_event_id_closing_sequence_key,966696,"CREATE UNIQUE INDEX tbl_closing_event_sale_event_id_closing_sequence_key ON landscape.tbl_closing_event USING btree (sale_event_id, closing_sequence)",True,tbl_closing_event_sale_event_id_closing_sequence_key,u
landscape,tbl_contacts,idx_contacts_company_name,163900,CREATE INDEX idx_contacts_company_name ON landscape.tbl_contacts USING btree (company_name),False,,
landscape,tbl_contacts,idx_contacts_project_role,753676,"CREATE INDEX idx_contacts_project_role ON landscape.tbl_contacts USING btree (project_id, contact_role)",False,,
landscape,tbl_contacts,tbl_contacts_pkey,163864,CREATE UNIQUE INDEX tbl_contacts_pkey ON landscape.tbl_contacts USING btree (contact_id),True,tbl_contacts_pkey,p
landscape,tbl_cost_allocation,idx_cost_alloc_container,663602,CREATE INDEX idx_cost_alloc_container ON landscape.tbl_cost_allocation USING btree (container_id),False,,
landscape,tbl_cost_allocation,idx_cost_alloc_structure,663601,CREATE INDEX idx_cost_alloc_structure ON landscape.tbl_cost_allocation USING btree (finance_structure_id),False,,
landscape,tbl_cost_allocation,idx_cost_allocation_scenario,696407,CREATE INDEX idx_cost_allocation_scenario ON landscape.tbl_cost_allocation USING btree (scenario_id),False,,
landscape,tbl_cost_allocation,tbl_cost_allocation_pkey,663587,CREATE UNIQUE INDEX tbl_cost_allocation_pkey ON landscape.tbl_cost_allocation USING btree (allocation_id),True,tbl_cost_allocation_pkey,p
landscape,tbl_cost_allocation,unique_allocation,663589,"CREATE UNIQUE INDEX unique_allocation ON landscape.tbl_cost_allocation USING btree (finance_structure_id, container_id)",True,unique_allocation,u
landscape,tbl_cost_approach,idx_cost_approach_project,770103,CREATE UNIQUE INDEX idx_cost_approach_project ON landscape.tbl_cost_approach USING btree (project_id),False,,
landscape,tbl_cost_approach,tbl_cost_approach_pkey,770096,CREATE UNIQUE INDEX tbl_cost_approach_pkey ON landscape.tbl_cost_approach USING btree (cost_approach_id),True,tbl_cost_approach_pkey,p
landscape,tbl_cre_absorption,tbl_cre_absorption_pkey,622877,CREATE UNIQUE INDEX tbl_cre_absorption_pkey ON landscape.tbl_cre_absorption USING btree (absorption_id),True,tbl_cre_absorption_pkey,p
landscape,tbl_cre_base_rent,idx_cre_base_rent_lease_id,761859,CREATE INDEX idx_cre_base_rent_lease_id ON landscape.tbl_cre_base_rent USING btree (lease_id),False,,
landscape,tbl_cre_base_rent,tbl_cre_base_rent_pkey,622674,CREATE UNIQUE INDEX tbl_cre_base_rent_pkey ON landscape.tbl_cre_base_rent USING btree (base_rent_id),True,tbl_cre_base_rent_pkey,p
landscape,tbl_cre_cam_charge,tbl_cre_cam_charge_pkey,622775,CREATE UNIQUE INDEX tbl_cre_cam_charge_pkey ON landscape.tbl_cre_cam_charge USING btree (cam_charge_id),True,tbl_cre_cam_charge_pkey,p
landscape,tbl_cre_cap_rate,tbl_cre_cap_rate_pkey,622917,CREATE UNIQUE INDEX tbl_cre_cap_rate_pkey ON landscape.tbl_cre_cap_rate USING btree (cap_rate_id),True,tbl_cre_cap_rate_pkey,p
landscape,tbl_cre_capital_reserve,tbl_cre_capital_reserve_pkey,630807,CREATE UNIQUE INDEX tbl_cre_capital_reserve_pkey ON landscape.tbl_cre_capital_reserve USING btree (capital_reserve_id),True,tbl_cre_capital_reserve_pkey,p
