schema_name,table_name,index_name,index_oid,indexdef,is_constraint_owned,constraint_name,constraint_type
landscape,tbl_cre_cash_flow,idx_cre_cash_flow_property_period,622994,"CREATE INDEX idx_cre_cash_flow_property_period ON landscape.tbl_cre_cash_flow USING btree (cre_property_id, period_id)",False,,
landscape,tbl_cre_cash_flow,tbl_cre_cash_flow_pkey,622931,CREATE UNIQUE INDEX tbl_cre_cash_flow_pkey ON landscape.tbl_cre_cash_flow USING btree (cash_flow_id),True,tbl_cre_cash_flow_pkey,p
landscape,tbl_cre_dcf_analysis,tbl_cre_dcf_analysis_pkey,622950,CREATE UNIQUE INDEX tbl_cre_dcf_analysis_pkey ON landscape.tbl_cre_dcf_analysis USING btree (dcf_analysis_id),True,tbl_cre_dcf_analysis_pkey,p
landscape,tbl_cre_expense_recovery,tbl_cre_expense_recovery_pkey,630794,CREATE UNIQUE INDEX tbl_cre_expense_recovery_pkey ON landscape.tbl_cre_expense_recovery USING btree (expense_recovery_id),True,tbl_cre_expense_recovery_pkey,p
landscape,tbl_cre_expense_reimbursement,tbl_cre_expense_reimbursement_pkey,622794,CREATE UNIQUE INDEX tbl_cre_expense_reimbursement_pkey ON landscape.tbl_cre_expense_reimbursement USING btree (reimbursement_id),True,tbl_cre_expense_reimbursement_pkey,p
landscape,tbl_cre_expense_stop,tbl_cre_expense_stop_pkey,622761,CREATE UNIQUE INDEX tbl_cre_expense_stop_pkey ON landscape.tbl_cre_expense_stop USING btree (expense_stop_id),True,tbl_cre_expense_stop_pkey,p
landscape,tbl_cre_lease,idx_cre_lease_expiration,622990,CREATE INDEX idx_cre_lease_expiration ON landscape.tbl_cre_lease USING btree (lease_expiration_date),False,,
landscape,tbl_cre_lease,idx_cre_lease_property,622987,CREATE INDEX idx_cre_lease_property ON landscape.tbl_cre_lease USING btree (cre_property_id),False,,
landscape,tbl_cre_lease,idx_cre_lease_space_id,761856,CREATE INDEX idx_cre_lease_space_id ON landscape.tbl_cre_lease USING btree (space_id),False,,
landscape,tbl_cre_lease,idx_cre_lease_status,622989,CREATE INDEX idx_cre_lease_status ON landscape.tbl_cre_lease USING btree (lease_status),False,,
landscape,tbl_cre_lease,idx_cre_lease_tenant,622988,CREATE INDEX idx_cre_lease_tenant ON landscape.tbl_cre_lease USING btree (tenant_id),False,,
landscape,tbl_cre_lease,idx_cre_lease_tenant_id,761857,CREATE INDEX idx_cre_lease_tenant_id ON landscape.tbl_cre_lease USING btree (tenant_id),False,,
landscape,tbl_cre_lease,tbl_cre_lease_pkey,622650,CREATE UNIQUE INDEX tbl_cre_lease_pkey ON landscape.tbl_cre_lease USING btree (lease_id),True,tbl_cre_lease_pkey,p
landscape,tbl_cre_leasing_commission,tbl_cre_leasing_commission_pkey,622830,CREATE UNIQUE INDEX tbl_cre_leasing_commission_pkey ON landscape.tbl_cre_leasing_commission USING btree (commission_id),True,tbl_cre_leasing_commission_pkey,p
landscape,tbl_cre_leasing_legal,tbl_cre_leasing_legal_pkey,622844,CREATE UNIQUE INDEX tbl_cre_leasing_legal_pkey ON landscape.tbl_cre_leasing_legal USING btree (legal_fee_id),True,tbl_cre_leasing_legal_pkey,p
landscape,tbl_cre_major_maintenance,tbl_cre_major_maintenance_pkey,630820,CREATE UNIQUE INDEX tbl_cre_major_maintenance_pkey ON landscape.tbl_cre_major_maintenance USING btree (major_maintenance_id),True,tbl_cre_major_maintenance_pkey,p
landscape,tbl_cre_noi,idx_cre_noi_property_period,622993,"CREATE INDEX idx_cre_noi_property_period ON landscape.tbl_cre_noi USING btree (cre_property_id, period_id)",False,,
landscape,tbl_cre_noi,tbl_cre_noi_pkey,622896,CREATE UNIQUE INDEX tbl_cre_noi_pkey ON landscape.tbl_cre_noi USING btree (noi_id),True,tbl_cre_noi_pkey,p
landscape,tbl_cre_operating_expense,tbl_cre_operating_expense_pkey,622738,CREATE UNIQUE INDEX tbl_cre_operating_expense_pkey ON landscape.tbl_cre_operating_expense USING btree (operating_expense_id),True,tbl_cre_operating_expense_pkey,p
landscape,tbl_cre_percentage_rent,tbl_cre_percentage_rent_pkey,622705,CREATE UNIQUE INDEX tbl_cre_percentage_rent_pkey ON landscape.tbl_cre_percentage_rent USING btree (percentage_rent_id),True,tbl_cre_percentage_rent_pkey,p
landscape,tbl_cre_property,idx_cre_property_project,622982,CREATE INDEX idx_cre_property_project ON landscape.tbl_cre_property USING btree (project_id),False,,
landscape,tbl_cre_property,idx_cre_property_status,622983,CREATE INDEX idx_cre_property_status ON landscape.tbl_cre_property USING btree (property_status),False,,
landscape,tbl_cre_property,idx_cre_property_type,622984,CREATE INDEX idx_cre_property_type ON landscape.tbl_cre_property USING btree (property_type),False,,
landscape,tbl_cre_property,tbl_cre_property_pkey,622599,CREATE UNIQUE INDEX tbl_cre_property_pkey ON landscape.tbl_cre_property USING btree (cre_property_id),True,tbl_cre_cam_charge_cre_property_id_fkey,f
landscape,tbl_cre_rent_concession,tbl_cre_rent_concession_pkey,622721,CREATE UNIQUE INDEX tbl_cre_rent_concession_pkey ON landscape.tbl_cre_rent_concession USING btree (concession_id),True,tbl_cre_rent_concession_pkey,p
landscape,tbl_cre_rent_escalation,tbl_cre_rent_escalation_pkey,622691,CREATE UNIQUE INDEX tbl_cre_rent_escalation_pkey ON landscape.tbl_cre_rent_escalation USING btree (escalation_id),True,tbl_cre_rent_escalation_pkey,p
landscape,tbl_cre_space,idx_cre_space_property,622985,CREATE INDEX idx_cre_space_property ON landscape.tbl_cre_space USING btree (cre_property_id),False,,
landscape,tbl_cre_space,idx_cre_space_property_id,761858,CREATE INDEX idx_cre_space_property_id ON landscape.tbl_cre_space USING btree (cre_property_id),False,,
landscape,tbl_cre_space,idx_cre_space_status,622986,CREATE INDEX idx_cre_space_status ON landscape.tbl_cre_space USING btree (space_status),False,,
landscape,tbl_cre_space,tbl_cre_space_pkey,622620,CREATE UNIQUE INDEX tbl_cre_space_pkey ON landscape.tbl_cre_space USING btree (space_id),True,tbl_cre_lease_space_id_fkey,f
landscape,tbl_cre_stabilization,tbl_cre_stabilization_pkey,622965,CREATE UNIQUE INDEX tbl_cre_stabilization_pkey ON landscape.tbl_cre_stabilization USING btree (stabilization_id),True,tbl_cre_stabilization_pkey,p
landscape,tbl_cre_tenant,idx_cre_tenant_credit,622992,CREATE INDEX idx_cre_tenant_credit ON landscape.tbl_cre_tenant USING btree (creditworthiness),False,,
landscape,tbl_cre_tenant,idx_cre_tenant_name,622991,CREATE INDEX idx_cre_tenant_name ON landscape.tbl_cre_tenant USING btree (tenant_name),False,,
landscape,tbl_cre_tenant,tbl_cre_tenant_pkey,622636,CREATE UNIQUE INDEX tbl_cre_tenant_pkey ON landscape.tbl_cre_tenant USING btree (tenant_id),True,tbl_cre_tenant_pkey,p
landscape,tbl_cre_tenant_improvement,tbl_cre_tenant_improvement_pkey,622816,CREATE UNIQUE INDEX tbl_cre_tenant_improvement_pkey ON landscape.tbl_cre_tenant_improvement USING btree (ti_id),True,tbl_cre_tenant_improvement_pkey,p
landscape,tbl_cre_vacancy,tbl_cre_vacancy_pkey,622858,CREATE UNIQUE INDEX tbl_cre_vacancy_pkey ON landscape.tbl_cre_vacancy USING btree (vacancy_id),True,tbl_cre_vacancy_pkey,p
landscape,tbl_debt_draw_schedule,idx_debt_draw_facility,508050,"CREATE INDEX idx_debt_draw_facility ON landscape.tbl_debt_draw_schedule USING btree (facility_id, period_id)",False,,
landscape,tbl_debt_draw_schedule,idx_debt_draw_period,508051,CREATE INDEX idx_debt_draw_period ON landscape.tbl_debt_draw_schedule USING btree (period_id),False,,
landscape,tbl_debt_draw_schedule,tbl_debt_draw_schedule_pkey,508036,CREATE UNIQUE INDEX tbl_debt_draw_schedule_pkey ON landscape.tbl_debt_draw_schedule USING btree (draw_id),True,tbl_debt_draw_schedule_pkey,p
landscape,tbl_debt_draw_schedule,uq_debt_draw_facility_period,508038,"CREATE UNIQUE INDEX uq_debt_draw_facility_period ON landscape.tbl_debt_draw_schedule USING btree (facility_id, period_id)",True,uq_debt_draw_facility_period,u
landscape,tbl_debt_facility,idx_debt_facility_project,508019,CREATE INDEX idx_debt_facility_project ON landscape.tbl_debt_facility USING btree (project_id),False,,
landscape,tbl_debt_facility,idx_debt_facility_type,508020,CREATE INDEX idx_debt_facility_type ON landscape.tbl_debt_facility USING btree (facility_type),False,,
landscape,tbl_debt_facility,idx_debt_project,647374,CREATE INDEX idx_debt_project ON landscape.tbl_debt_facility USING btree (project_id),False,,
landscape,tbl_debt_facility,tbl_debt_facility_pkey,508007,CREATE UNIQUE INDEX tbl_debt_facility_pkey ON landscape.tbl_debt_facility USING btree (facility_id),True,tbl_debt_facility_pkey,p
landscape,tbl_division,idx_container_project_level,311327,"CREATE INDEX idx_container_project_level ON landscape.tbl_division USING btree (project_id, tier, sort_order, division_id)",False,,
landscape,tbl_division,idx_container_sale_phase,958493,"CREATE INDEX idx_container_sale_phase ON landscape.tbl_division USING btree (project_id, sale_phase_code) WHERE (sale_phase_code IS NOT NULL)",False,,
landscape,tbl_division,idx_division_parent,311328,CREATE INDEX idx_division_parent ON landscape.tbl_division USING btree (parent_division_id),False,,
landscape,tbl_division,tbl_container_pkey,311313,CREATE UNIQUE INDEX tbl_container_pkey ON landscape.tbl_division USING btree (division_id),True,tbl_container_pkey,p
landscape,tbl_division,uq_container_code,311315,"CREATE UNIQUE INDEX uq_container_code ON landscape.tbl_division USING btree (project_id, division_code)",True,uq_container_code,u
landscape,tbl_equity,idx_equity_project,499973,CREATE INDEX idx_equity_project ON landscape.tbl_equity USING btree (project_id),False,,
landscape,tbl_equity,idx_equity_tier,499974,"CREATE INDEX idx_equity_tier ON landscape.tbl_equity USING btree (project_id, equity_tier)",False,,
landscape,tbl_equity,tbl_equity_pkey,499966,CREATE UNIQUE INDEX tbl_equity_pkey ON landscape.tbl_equity USING btree (equity_id),True,tbl_equity_pkey,p
landscape,tbl_equity_distribution,idx_equity_distribution_partner,508095,"CREATE INDEX idx_equity_distribution_partner ON landscape.tbl_equity_distribution USING btree (partner_id, period_id)",False,,
landscape,tbl_equity_distribution,idx_equity_distribution_period,508096,CREATE INDEX idx_equity_distribution_period ON landscape.tbl_equity_distribution USING btree (period_id),False,,
landscape,tbl_equity_distribution,idx_equity_distribution_type,508097,CREATE INDEX idx_equity_distribution_type ON landscape.tbl_equity_distribution USING btree (distribution_type),False,,
landscape,tbl_equity_distribution,tbl_equity_distribution_pkey,508083,CREATE UNIQUE INDEX tbl_equity_distribution_pkey ON landscape.tbl_equity_distribution USING btree (distribution_id),True,tbl_equity_distribution_pkey,p
landscape,tbl_equity_partner,idx_equity_partner_class,508070,CREATE INDEX idx_equity_partner_class ON landscape.tbl_equity_partner USING btree (partner_class),False,,
landscape,tbl_equity_partner,idx_equity_partner_project,508069,CREATE INDEX idx_equity_partner_project ON landscape.tbl_equity_partner USING btree (project_id),False,,
landscape,tbl_equity_partner,tbl_equity_partner_pkey,508062,CREATE UNIQUE INDEX tbl_equity_partner_pkey ON landscape.tbl_equity_partner USING btree (partner_id),True,tbl_equity_partner_pkey,p
landscape,tbl_equity_structure,tbl_equity_structure_pkey,647325,CREATE UNIQUE INDEX tbl_equity_structure_pkey ON landscape.tbl_equity_structure USING btree (equity_structure_id),True,tbl_equity_structure_pkey,p
landscape,tbl_escalation,idx_escalation_lease,499830,CREATE INDEX idx_escalation_lease ON landscape.tbl_escalation USING btree (lease_id),False,,
landscape,tbl_escalation,idx_escalation_type,499831,CREATE INDEX idx_escalation_type ON landscape.tbl_escalation USING btree (escalation_type),False,,
landscape,tbl_escalation,tbl_escalation_pkey,499823,CREATE UNIQUE INDEX tbl_escalation_pkey ON landscape.tbl_escalation USING btree (escalation_id),True,tbl_escalation_pkey,p
landscape,tbl_expense_detail,idx_expense_detail_category,647372,CREATE INDEX idx_expense_detail_category ON landscape.tbl_expense_detail USING btree (expense_category),False,,
landscape,tbl_expense_detail,idx_expense_detail_project,647371,CREATE INDEX idx_expense_detail_project ON landscape.tbl_expense_detail USING btree (project_id),False,,
landscape,tbl_expense_detail,tbl_expense_detail_pkey,647281,CREATE UNIQUE INDEX tbl_expense_detail_pkey ON landscape.tbl_expense_detail USING btree (expense_detail_id),True,tbl_expense_detail_pkey,p
landscape,tbl_extraction_log,idx_extraction_log_doc,1507373,CREATE INDEX idx_extraction_log_doc ON landscape.tbl_extraction_log USING btree (doc_id),False,,
landscape,tbl_extraction_log,idx_extraction_log_mapping,1507371,CREATE INDEX idx_extraction_log_mapping ON landscape.tbl_extraction_log USING btree (mapping_id),False,,
landscape,tbl_extraction_log,idx_extraction_log_project,1507372,CREATE INDEX idx_extraction_log_project ON landscape.tbl_extraction_log USING btree (project_id),False,,
landscape,tbl_extraction_log,tbl_extraction_log_pkey,1507361,CREATE UNIQUE INDEX tbl_extraction_log_pkey ON landscape.tbl_extraction_log USING btree (log_id),True,tbl_extraction_log_pkey,p
landscape,tbl_extraction_mapping,idx_extraction_mapping_active,1507370,CREATE INDEX idx_extraction_mapping_active ON landscape.tbl_extraction_mapping USING btree (is_active) WHERE (is_active = true),False,,
landscape,tbl_extraction_mapping,idx_extraction_mapping_doctype,1507368,CREATE INDEX idx_extraction_mapping_doctype ON landscape.tbl_extraction_mapping USING btree (document_type),False,,
landscape,tbl_extraction_mapping,idx_extraction_mapping_target,1507369,"CREATE INDEX idx_extraction_mapping_target ON landscape.tbl_extraction_mapping USING btree (target_table, target_field)",False,,
landscape,tbl_extraction_mapping,tbl_extraction_mapping_pkey,1507348,CREATE UNIQUE INDEX tbl_extraction_mapping_pkey ON landscape.tbl_extraction_mapping USING btree (mapping_id),True,tbl_extraction_mapping_pkey,p
landscape,tbl_extraction_mapping,uq_mapping_pattern_field,1507350,"CREATE UNIQUE INDEX uq_mapping_pattern_field ON landscape.tbl_extraction_mapping USING btree (document_type, source_pattern, target_table, target_field)",True,uq_mapping_pattern_field,u
landscape,tbl_field_catalog,idx_field_catalog_editable,1466388,CREATE INDEX idx_field_catalog_editable ON landscape.tbl_field_catalog USING btree (is_editable) WHERE (is_editable = true),False,,
landscape,tbl_field_catalog,idx_field_catalog_group,1466387,CREATE INDEX idx_field_catalog_group ON landscape.tbl_field_catalog USING btree (field_group),False,,
landscape,tbl_field_catalog,idx_field_catalog_table,1466386,CREATE INDEX idx_field_catalog_table ON landscape.tbl_field_catalog USING btree (table_name),False,,
landscape,tbl_field_catalog,tbl_field_catalog_pkey,1466382,CREATE UNIQUE INDEX tbl_field_catalog_pkey ON landscape.tbl_field_catalog USING btree (field_id),True,tbl_field_catalog_pkey,p
landscape,tbl_field_catalog,tbl_field_catalog_table_name_field_name_key,1466384,"CREATE UNIQUE INDEX tbl_field_catalog_table_name_field_name_key ON landscape.tbl_field_catalog USING btree (table_name, field_name)",True,tbl_field_catalog_table_name_field_name_key,u
landscape,tbl_finance_structure,idx_finance_structure_active,663577,CREATE INDEX idx_finance_structure_active ON landscape.tbl_finance_structure USING btree (is_active) WHERE (is_active = true),False,,
landscape,tbl_finance_structure,idx_finance_structure_project,663575,CREATE INDEX idx_finance_structure_project ON landscape.tbl_finance_structure USING btree (project_id),False,,
landscape,tbl_finance_structure,idx_finance_structure_scenario,696401,CREATE INDEX idx_finance_structure_scenario ON landscape.tbl_finance_structure USING btree (scenario_id),False,,
landscape,tbl_finance_structure,idx_finance_structure_type,663576,CREATE INDEX idx_finance_structure_type ON landscape.tbl_finance_structure USING btree (structure_type),False,,
landscape,tbl_finance_structure,tbl_finance_structure_pkey,663566,CREATE UNIQUE INDEX tbl_finance_structure_pkey ON landscape.tbl_finance_structure USING btree (finance_structure_id),True,tbl_finance_structure_pkey,p
landscape,tbl_finance_structure,unique_structure_code,663568,"CREATE UNIQUE INDEX unique_structure_code ON landscape.tbl_finance_structure USING btree (project_id, structure_code)",True,unique_structure_code,u
landscape,tbl_global_benchmark_registry,idx_benchmark_registry_active,843809,CREATE INDEX idx_benchmark_registry_active ON landscape.tbl_global_benchmark_registry USING btree (is_active),False,,
landscape,tbl_global_benchmark_registry,idx_benchmark_registry_as_of_date,843810,CREATE INDEX idx_benchmark_registry_as_of_date ON landscape.tbl_global_benchmark_registry USING btree (as_of_date),False,,
landscape,tbl_global_benchmark_registry,idx_benchmark_registry_category,843806,"CREATE INDEX idx_benchmark_registry_category ON landscape.tbl_global_benchmark_registry USING btree (category, subcategory)",False,,
landscape,tbl_global_benchmark_registry,idx_benchmark_registry_geography,843807,CREATE INDEX idx_benchmark_registry_geography ON landscape.tbl_global_benchmark_registry USING btree (market_geography),False,,
landscape,tbl_global_benchmark_registry,idx_benchmark_registry_property_type,843808,CREATE INDEX idx_benchmark_registry_property_type ON landscape.tbl_global_benchmark_registry USING btree (property_type),False,,
landscape,tbl_global_benchmark_registry,idx_benchmark_registry_user,843805,CREATE INDEX idx_benchmark_registry_user ON landscape.tbl_global_benchmark_registry USING btree (user_id),False,,
landscape,tbl_global_benchmark_registry,tbl_global_benchmark_registry_pkey,843793,CREATE UNIQUE INDEX tbl_global_benchmark_registry_pkey ON landscape.tbl_global_benchmark_registry USING btree (benchmark_id),True,tbl_global_benchmark_registry_pkey,p
landscape,tbl_income_approach,idx_income_approach_project,770123,CREATE UNIQUE INDEX idx_income_approach_project ON landscape.tbl_income_approach USING btree (project_id),False,,
landscape,tbl_income_approach,tbl_income_approach_pkey,770116,CREATE UNIQUE INDEX tbl_income_approach_pkey ON landscape.tbl_income_approach USING btree (income_approach_id),True,tbl_income_approach_pkey,p
landscape,tbl_inventory_item,idx_inventory_active,573486,CREATE INDEX idx_inventory_active ON landscape.tbl_inventory_item USING btree (is_active) WHERE (is_active = true),False,,
landscape,tbl_inventory_item,idx_inventory_code,573485,CREATE INDEX idx_inventory_code ON landscape.tbl_inventory_item USING btree (item_code),False,,
landscape,tbl_inventory_item,idx_inventory_container,573482,CREATE INDEX idx_inventory_container ON landscape.tbl_inventory_item USING btree (container_id),False,,
landscape,tbl_inventory_item,idx_inventory_data_gin,573488,CREATE INDEX idx_inventory_data_gin ON landscape.tbl_inventory_item USING gin (data_values),False,,
landscape,tbl_inventory_item,idx_inventory_family,589839,CREATE INDEX idx_inventory_family ON landscape.tbl_inventory_item USING btree (family_id),False,,
landscape,tbl_inventory_item,idx_inventory_hierarchy_gin,573487,CREATE INDEX idx_inventory_hierarchy_gin ON landscape.tbl_inventory_item USING gin (hierarchy_values),False,,
landscape,tbl_inventory_item,idx_inventory_product,589840,CREATE INDEX idx_inventory_product ON landscape.tbl_inventory_item USING btree (product_id),False,,
landscape,tbl_inventory_item,idx_inventory_project,573481,CREATE INDEX idx_inventory_project ON landscape.tbl_inventory_item USING btree (project_id),False,,
landscape,tbl_inventory_item,idx_inventory_status,573484,CREATE INDEX idx_inventory_status ON landscape.tbl_inventory_item USING btree (status),False,,
landscape,tbl_inventory_item,idx_inventory_type,573483,CREATE INDEX idx_inventory_type ON landscape.tbl_inventory_item USING btree (property_type),False,,
landscape,tbl_inventory_item,tbl_inventory_item_pkey,573467,CREATE UNIQUE INDEX tbl_inventory_item_pkey ON landscape.tbl_inventory_item USING btree (item_id),True,tbl_inventory_item_pkey,p
landscape,tbl_inventory_item,uq_inventory_item_code,573469,"CREATE UNIQUE INDEX uq_inventory_item_code ON landscape.tbl_inventory_item USING btree (project_id, item_code)",True,uq_inventory_item_code,u
landscape,tbl_item_dependency,idx_item_dependency_dependent,507920,"CREATE INDEX idx_item_dependency_dependent ON landscape.tbl_item_dependency USING btree (dependent_item_type, dependent_item_id)",False,,
landscape,tbl_item_dependency,idx_item_dependency_trigger,507921,"CREATE INDEX idx_item_dependency_trigger ON landscape.tbl_item_dependency USING btree (trigger_item_type, trigger_item_id)",False,,
landscape,tbl_item_dependency,tbl_item_dependency_pkey,507918,CREATE UNIQUE INDEX tbl_item_dependency_pkey ON landscape.tbl_item_dependency USING btree (dependency_id),True,tbl_item_dependency_pkey,p
landscape,tbl_landuse,idx_tbl_landuse_active,213007,CREATE INDEX idx_tbl_landuse_active ON landscape.tbl_landuse USING btree (active),False,,
landscape,tbl_landuse,idx_tbl_landuse_code,212999,CREATE INDEX idx_tbl_landuse_code ON landscape.tbl_landuse USING btree (landuse_code),False,,
landscape,tbl_landuse,idx_tbl_landuse_subtype,212998,CREATE INDEX idx_tbl_landuse_subtype ON landscape.tbl_landuse USING btree (type_id),False,,
landscape,tbl_landuse,tbl_landuse_landuse_code_key,40996,CREATE UNIQUE INDEX tbl_landuse_landuse_code_key ON landscape.tbl_landuse USING btree (landuse_code),True,tbl_parcels_landuse_code_fkey,f
landscape,tbl_landuse,tbl_landuse_pkey,40994,CREATE UNIQUE INDEX tbl_landuse_pkey ON landscape.tbl_landuse USING btree (landuse_id),True,tbl_landuse_pkey,p
landscape,tbl_landuse_program,tbl_landuse_program_pkey,90118,CREATE UNIQUE INDEX tbl_landuse_program_pkey ON landscape.tbl_landuse_program USING btree (landuse_code),True,tbl_landuse_program_pkey,p
landscape,tbl_lease,idx_lease_expiration,499790,CREATE INDEX idx_lease_expiration ON landscape.tbl_lease USING btree (lease_expiration_date),False,,
landscape,tbl_lease,idx_lease_lot,499788,CREATE INDEX idx_lease_lot ON landscape.tbl_lease USING btree (lot_id),False,,
landscape,tbl_lease,idx_lease_parcel,499787,CREATE INDEX idx_lease_parcel ON landscape.tbl_lease USING btree (parcel_id),False,,
landscape,tbl_lease,idx_lease_project,499786,CREATE INDEX idx_lease_project ON landscape.tbl_lease USING btree (project_id),False,,
landscape,tbl_lease,idx_lease_status,499789,"CREATE INDEX idx_lease_status ON landscape.tbl_lease USING btree (lease_status, affects_occupancy)",False,,
landscape,tbl_lease,idx_lease_tenant,499791,CREATE INDEX idx_lease_tenant ON landscape.tbl_lease USING btree (tenant_name),False,,
landscape,tbl_lease,tbl_lease_pkey,499769,CREATE UNIQUE INDEX tbl_lease_pkey ON landscape.tbl_lease USING btree (lease_id),True,tbl_lease_pkey,p
landscape,tbl_lease_assumptions,idx_lease_assumptions_project,516223,CREATE INDEX idx_lease_assumptions_project ON landscape.tbl_lease_assumptions USING btree (project_id),False,,
landscape,tbl_lease_assumptions,idx_lease_assumptions_space_type,516224,CREATE INDEX idx_lease_assumptions_space_type ON landscape.tbl_lease_assumptions USING btree (space_type),False,,
landscape,tbl_lease_assumptions,tbl_lease_assumptions_pkey,516214,CREATE UNIQUE INDEX tbl_lease_assumptions_pkey ON landscape.tbl_lease_assumptions USING btree (assumption_id),True,tbl_lease_assumptions_pkey,p
landscape,tbl_lease_assumptions,tbl_lease_assumptions_project_id_space_type_effective_date_key,516216,"CREATE UNIQUE INDEX tbl_lease_assumptions_project_id_space_type_effective_date_key ON landscape.tbl_lease_assumptions USING btree (project_id, space_type, effective_date)",True,tbl_lease_assumptions_project_id_space_type_effective_date_key,u
landscape,tbl_lease_revenue_timing,idx_lease_revenue_timing_lease,516309,CREATE INDEX idx_lease_revenue_timing_lease ON landscape.tbl_lease_revenue_timing USING btree (lease_id),False,,
landscape,tbl_lease_revenue_timing,idx_lease_revenue_timing_period,516310,CREATE INDEX idx_lease_revenue_timing_period ON landscape.tbl_lease_revenue_timing USING btree (period_id),False,,
landscape,tbl_lease_revenue_timing,idx_lease_revenue_timing_project,516308,CREATE INDEX idx_lease_revenue_timing_project ON landscape.tbl_lease_revenue_timing USING btree (project_id),False,,
landscape,tbl_lease_revenue_timing,idx_lease_revenue_timing_project_period,516311,"CREATE INDEX idx_lease_revenue_timing_project_period ON landscape.tbl_lease_revenue_timing USING btree (project_id, period_id)",False,,
landscape,tbl_lease_revenue_timing,tbl_lease_revenue_timing_lease_id_period_id_key,516296,"CREATE UNIQUE INDEX tbl_lease_revenue_timing_lease_id_period_id_key ON landscape.tbl_lease_revenue_timing USING btree (lease_id, period_id)",True,tbl_lease_revenue_timing_lease_id_period_id_key,u
landscape,tbl_lease_revenue_timing,tbl_lease_revenue_timing_pkey,516294,CREATE UNIQUE INDEX tbl_lease_revenue_timing_pkey ON landscape.tbl_lease_revenue_timing USING btree (timing_id),True,tbl_lease_revenue_timing_pkey,p
landscape,tbl_leasing_commission,idx_commission_lease,499907,CREATE INDEX idx_commission_lease ON landscape.tbl_leasing_commission USING btree (lease_id),False,,
landscape,tbl_leasing_commission,tbl_leasing_commission_pkey,499898,CREATE UNIQUE INDEX tbl_leasing_commission_pkey ON landscape.tbl_leasing_commission USING btree (commission_id),True,tbl_leasing_commission_pkey,p
landscape,tbl_leasing_commission,uq_commission_lease,499900,CREATE UNIQUE INDEX uq_commission_lease ON landscape.tbl_leasing_commission USING btree (lease_id),True,uq_commission_lease,u
landscape,tbl_loan,idx_loan_project,499953,CREATE INDEX idx_loan_project ON landscape.tbl_loan USING btree (project_id),False,,
landscape,tbl_loan,idx_loan_type,499954,CREATE INDEX idx_loan_type ON landscape.tbl_loan USING btree (loan_type),False,,
landscape,tbl_loan,tbl_loan_pkey,499946,CREATE UNIQUE INDEX tbl_loan_pkey ON landscape.tbl_loan USING btree (loan_id),True,tbl_loan_pkey,p
landscape,tbl_lot,idx_lot_parcel,499748,CREATE INDEX idx_lot_parcel ON landscape.tbl_lot USING btree (parcel_id),False,,
landscape,tbl_lot,idx_lot_phase,499749,CREATE INDEX idx_lot_phase ON landscape.tbl_lot USING btree (phase_id),False,,
